{
  "version": "1.0",
  "name": "Payment Request Workflow",
  "desc": "Payment request processing workflow with validation, approval, and notification states",
  "initialState": "INVALID",
  "active": true,
  "states": {
    "INVALID": {
      "transitions": [
        {
          "name": "VALIDATE",
          "next": "PENDING",
          "manual": true,
          "disabled": false,
          "criterion": {
            "type": "function",
            "function": {
              "name": "IsValid",
              "config": {
                "attachEntity": true
              }
            }
          }
        },
        {
          "name": "AMEND",
          "next": "INVALID",
          "manual": true,
          "disabled": false
        },
        {
          "name": "CANCEL",
          "next": "CANCELED",
          "manual": true,
          "disabled": false
        },
        {
          "name": "STP",
          "next": "INVALID",
          "manual": false,
          "disabled": false,
          "processors": [
            {
              "name": "Filter",
              "executionMode": "SYNC",
              "config": {
                "attachEntity": true
              }
            }
          ]
        },
        {
          "name": "Process",
          "next": "INVALID",
          "manual": true,
          "disabled": false,
          "processors": [
            {
              "name": "Process",
              "executionMode": "SYNC",
              "config": {
                "attachEntity": true
              }
            }
          ]
        }
      ]
    },
    "PENDING": {
      "transitions": [
        {
          "name": "MATCH",
          "next": "SUBMITTED",
          "manual": true,
          "disabled": false,
          "criterion": {
            "type": "function",
            "function": {
              "name": "HasOrder",
              "config": {
                "attachEntity": true
              }
            }
          }
        },
        {
          "name": "RETRY",
          "next": "PENDING",
          "manual": true,
          "disabled": false
        },
        {
          "name": "CANCEL",
          "next": "CANCELED",
          "manual": true,
          "disabled": false
        }
      ]
    },
    "SUBMITTED": {
      "transitions": [
        {
          "name": "APPROVE",
          "next": "APPROVED",
          "manual": true,
          "disabled": false
        },
        {
          "name": "DENY",
          "next": "DECLINED",
          "manual": true,
          "disabled": false
        }
      ]
    },
    "APPROVED": {
      "transitions": [
        {
          "name": "Create Payment Message",
          "next": "APPROVED",
          "manual": false,
          "disabled": false,
          "processors": [
            {
              "name": "Create Payment Message",
              "executionMode": "ASYNC_NEW_TX",
              "config": {
                "attachEntity": true
              }
            }
          ]
        },
        {
          "name": "Send ACK Notification",
          "next": "APPROVED",
          "manual": false,
          "disabled": false,
          "processors": [
            {
              "name": "Send ACK Notification",
              "executionMode": "ASYNC_NEW_TX",
              "config": {
                "attachEntity": false
              }
            }
          ]
        }
      ]
    },
    "DECLINED": {
      "transitions": [
        {
          "name": "Send NACK Notification",
          "next": "DECLINED",
          "manual": false,
          "disabled": false,
          "processors": [
            {
              "name": "Send NACK Notification",
              "executionMode": "ASYNC_NEW_TX",
              "config": {
                "attachEntity": false
              }
            }
          ]
        }
      ]
    },
    "CANCELED": {
      "transitions": []
    }
  }
}